{
  "$schema": "./agent-host.schema.json",
  "environment": "production",
  "slotCount": 4,
  "backend": {
    "name": "cursor",
    "model": "composer-2.5",
    "isolation": {
      "slotLauncher": true,
      "osSandbox": "workspace",
      "toolGate": "preToolUse-failClosed"
    }
  },
  "discord": {
    "showThinking": false,
    "streaming": false,
    "completionNotify": "off"
  },
  "pins": {
    "cursorAgent": {
      "version": "2026.08.11-e8db854",
      "sha256": {
        "x86_64": "bfff4bf6f4e9dd30c1d0ef0a70b6077b074015dd2948e4c50685d53afdcfce5a",
        "aarch64": "ea13f92e295f523a99ce8d8f57d6894d21e5d1e2d030ffad718ccd5955ca2eed"
      }
    },
    "xangi": {
      "repo": "https://github.com/gdg-jp/xangi.git",
      "ref": "f69572739f46931cff1d3edbe7c34409a9f329ee"
    },
    "gws": {
      "version": "v0.22.5",
      "sha256": {
        "x86_64": "de78ecdbd2f1a84cca0063a7ecbc440240fc14b6ebccbb17f4646b792a8c5c1f",
        "aarch64": "94490295d9580e1e88574e715a0a162991747d12d62f8c7b8dcc8268b6c1cea0"
      }
    },
    "gdgCli": {
      "version": "0.4.4",
      "assetTemplate": "gdg_{version}_linux_{arch}.zip",
      "sha256": {
        "x86_64": "329eb234a741c8d2db56f30c7847255fb287551276d8589768c87b29a53f30c8",
        "aarch64": "57d13f222357e1ee9eefec4fc9f3f3c70c293952c864aa5871bc1f135ecb3881"
      }
    },
    "node": {
      "major": 22,
      "minMinor": 18
    },
    "antigravity": {
      "version": "1.1.27",
      "sha256": {
        "x86_64": "93eb2118b778a4005700b54cdd7e08b896fbe665d5ff338e38e9e53da9a091ea"
      }
    }
  },
  "paths": {
    "agentRoot": "/opt/gdg-agent",
    "workspace": "/srv/gdg-agent/wiki",
    "runRoot": "/run/gdg-agent"
  },
  "agentsIndex": {
    "enabled": true,
    "dataDir": "/var/lib/agents-index",
    "dbPath": "/var/lib/agents-index/index.db"
  },
  "workspaceSync": {
    "interval": "5min",
    "source": "https://github.com/gdg-jp/gdgjp/releases/download/agent-host-workspace-latest/agent-host-workspace.manifest.json"
  },
  "release": {
    "manifestBaseURL": "https://github.com/gdg-jp/gdgjp/releases/download/agent-host-release-latest",
    "applyInterval": "1h",
    "keep": 5
  }
}
